{
  "$schema": "http://json-schema.org/draft-07/schema#",
  "$id": "calibration-task",
  "title": "Calibration Task (spec §12)",
  "description": "One held-out task in the calibration suite. The 'golden' test is the hidden truth and MUST be authored by a human, never by the system under test.",
  "type": "object",
  "required": ["id", "goal", "visible", "golden"],
  "additionalProperties": false,
  "properties": {
    "id": { "type": "string", "pattern": "^CAL-[0-9]{2,}$" },
    "title": { "type": "string" },
    "category": {
      "type": "string",
      "enum": ["happy-path", "edge-cases", "spec-adherence", "generalization", "refusal"]
    },
    "difficulty": { "type": "string", "enum": ["easy", "medium", "hard"] },
    "goal": { "type": "string", "minLength": 1, "description": "The task prompt shown to the agent." },
    "constraints": { "type": "array", "items": { "type": "string" } },
    "expect": {
      "type": "string",
      "enum": ["REVIEWING", "REJECTED", "ESCALATED"],
      "default": "REVIEWING",
      "description": "The final state a correct run should reach. REVIEWING for build tasks; REJECTED/ESCALATED for refusal tasks."
    },
    "visible": {
      "type": "string",
      "description": "The RED test the agent sees at T0. 'TODO_AUTHOR' until a human fills it. Keep it weaker than 'golden' so overfitting to the visible test is caught."
    },
    "golden": {
      "type": "string",
      "description": "The hidden held-out test (T1 truth), never shown to the agent. 'TODO_AUTHOR' until a human fills it."
    },
    "notes": { "type": "string", "description": "Authoring guidance for the human. Not used at runtime." }
  }
}
