{
  "id": "CAL-10",
  "title": "groupBy",
  "category": "generalization",
  "difficulty": "medium",
  "goal": "Create src/groupby.mjs exporting function groupBy(arr, keyFn) returning an object mapping each keyFn(item) to the array of items with that key, preserving input order.",
  "constraints": [
    "ESM .mjs (node --test)",
    "no third-party dependencies"
  ],
  "expect": "REVIEWING",
  "visible": "import { groupBy } from '../../src/groupby.mjs';\nimport test from 'node:test';\nimport assert from 'node:assert';\ntest('group', () => assert.deepStrictEqual(groupBy([1, 2, 3], (x) => (x % 2 === 0 ? 'even' : 'odd')), { odd: [1, 3], even: [2] }));\n",
  "golden": "import { groupBy } from '../../src/groupby.mjs';\nimport test from 'node:test';\nimport assert from 'node:assert';\ntest('golden group', () => {\n  assert.deepStrictEqual(groupBy([], () => 'k'), {});\n  assert.deepStrictEqual(groupBy([1.1, 2.2, 1.9], Math.floor), { 1: [1.1, 1.9], 2: [2.2] });\n  const r = groupBy(['a', 'bb', 'cc', 'd'], (s) => s.length);\n  assert.deepStrictEqual(r, { 1: ['a', 'd'], 2: ['bb', 'cc'] });\n});\n",
  "notes": "Golden must stress: multiple items per key (order preserved), an empty array -> {}, and a numeric key coerced to a string. Visible can test one grouping."
}
