{
  "id": "CAL-15",
  "title": "mergeSorted",
  "category": "edge-cases",
  "difficulty": "medium",
  "goal": "Create src/merge.mjs exporting function mergeSorted(a, b) merging two ascending-sorted numeric arrays into one ascending-sorted array (duplicates kept).",
  "constraints": [
    "ESM .mjs (node --test)",
    "no third-party dependencies"
  ],
  "expect": "REVIEWING",
  "visible": "import { mergeSorted } from '../../src/merge.mjs';\nimport test from 'node:test';\nimport assert from 'node:assert';\ntest('merge', () => assert.deepStrictEqual(mergeSorted([1, 3], [2, 4]), [1, 2, 3, 4]));\n",
  "golden": "import { mergeSorted } from '../../src/merge.mjs';\nimport test from 'node:test';\nimport assert from 'node:assert';\ntest('golden merge', () => {\n  assert.deepStrictEqual(mergeSorted([], [1, 2]), [1, 2]);\n  assert.deepStrictEqual(mergeSorted([1, 4, 5], [2, 3, 6]), [1, 2, 3, 4, 5, 6]);\n  assert.deepStrictEqual(mergeSorted([1, 2], [2, 3]), [1, 2, 2, 3]);\n  assert.strictEqual(mergeSorted([1, 2, 3], [4, 5]).length, 5);\n});\n",
  "notes": "Golden must stress: one empty input, interleaved values, duplicates across both arrays, and result length === a.length + b.length. Visible can test two short disjoint arrays."
}
